<!ELEMENT games (game)>
<!ELEMENT game (name, description, score)>
<!ELEMENT name (#PCDATA)>
<!ELEMENT description (#PCDATA)>
<!ELEMENT score (#PCDATA)>
